ID,ACCESS,AUTHOR_NAME,CONTACT_EMAIL,CONTACT_NAME,DATA_DICTIONARY,DATA_DICTIONARY_TYPE,DATA_STANDARD,DESCRIPTION,FREQUENCY,GRANULARITY,HOMEPAGE,LANGUAGE,LICENSE,RELEASED_DATE,MODIFIED_DATE,PUBLISHER,RELATED_CONTENT,SPATIAL_COVERAGE_AREA,SPATIAL_COVERAGE_LOCATION,TAGS,TEMPORAL_COVERAGE_END,TEMPORAL_COVERAGE_START,TITLE,TOPICS
55,public,Government of Canada; Natural Resources Canada; Earth Sciences Sector,mailto:Geomatics.Help@yukon.ca,Geomatics Yukon,Places,,," Hydro Features is composed of the network of Canadian surface waters. Hydro Features entities are: Watercourse, Water Linear Flow, Hydro Obstacle (falls, rapids...), Waterbody (lake, watercourse...), Permanent Snow and Ice, Water Well, and Spring. CanVec is a digital cartographic reference product of Natural Resources Canada (NRCan). It originates from the best available data sources covering Canadian territory, offers quality topographical information in vector format, and complies with international geomatics standards. CanVec is a multi-source product coming mainly from the National Topographic Data Base (NTDB), the Mapping the North process conducted by the Canada Center for Mapping and Earth Observation (CCMEO), the Atlas of Canada data, the GeoBase initiative, and the data update using satellite imagery coverage (e.g. Landsat 7, Spot, Radarsat, etc.).<br><br>  Distributed from <a href='https://yukon.ca/geoyukon' rel='nofollow ugc' style='text-decoration:underline;'>  GeoYukon</a>   by the <a href='https://yukon.ca/maps' rel='nofollow ugc' style='text-decoration:underline;'>  Government of Yukon</a>  . Discover more digital map data and interactive maps from Yukon's digital map data collection.<br><br>  For more information: <a href='mailto:geomatics.help@yukon.ca' rel='nofollow ugc' style='text-decoration:underline;'>  geomatics.help@yukon.ca</a><br><br>",As Needed,,https://yukon.maps.arcgis.com/home/item.html?id=7d2acc6ce21c4a8faf2459669ba8d1b9,,ogly,2017-10-26T06:07:26.000Z,2021-01-03T18:42:14.000Z,Geomatics Yukon,https://yukon.maps.arcgis.com/sharing/rest/content/items/7d2acc6ce21c4a8faf2459669ba8d1b9/info/metadata/metadata.xml,"-140.4615,58.7387,-117.2152,69.1844",Yukon,"Earth Science,CanVec,Hydrography,GeoYukon,Yukon,Raster,nrcan,Government,Image,GeoYukon",,,Watercourses - 50k - Canvec,"Nature and environment,Science and Technology"
326,public,Department of Tourism and Culture - Government of Yukon,mailto:Geomatics.Help@yukon.ca,Geomatics Yukon,Places,,, Locations of municipal and territorial designated historic sites under the Historic Resources Act<br><br>  Distributed from <a href='https://yukon.ca/geoyukon' rel='nofollow ugc'>  GeoYukon</a>   by the <a href='https://yukon.ca/maps' rel='nofollow ugc'>  Government of Yukon</a>  . Discover more digital map data and interactive maps from Yukon's digital map data collection.<br><br>  For more information: <a href='mailto:geomatics.help@yukon.ca' rel='nofollow ugc'>  geomatics.help@yukon.ca</a><br><br>,As Needed,,https://yukon.maps.arcgis.com/home/item.html?id=7d34e4834b734939acd4222827ba9899,,ogly,2016-06-09T18:17:35.000Z,2024-10-17T21:53:14.000Z,Geomatics Yukon,https://yukon.maps.arcgis.com/sharing/rest/content/items/7d34e4834b734939acd4222827ba9899/info/metadata/metadata.xml,"-138.9962,59.9526,-127.5200,67.6559",Yukon,"designated historic sites,Historic Resources Act,historic sites,Yukon,GeoYukon,Transportation,GeoYukon",,,Designated Historic Sites,Transport
161,public,Land Planning Branch – Government of Yukon,mailto:Geomatics.Help@yukon.ca,Geomatics Yukon,Places,,," Examples of linework include: Dog Mushing Trails - part of the Mount Lorne/Carcross Road Area Plan, Schedule B - Land Use Plan200 Metre River Setback - part of the Golden Horn Local Area Plan, Schedule A, Land Management Plan<br><br>  Distributed from <a href='https://yukon.ca/geoyukon' rel='nofollow ugc'>  GeoYukon</a>   by the <a href='https://yukon.ca/maps' rel='nofollow ugc'>  Government of Yukon</a>  . Discover more digital map data and interactive maps from Yukon's digital map data collection.<br><br>  For more information:   <a href='mailto:geomatics.help@yukon.ca' rel='nofollow ugc'>geomatics.hel</a><a href='mailto:geomatics.help@yukon.ca' rel='nofollow ugc'>p@yukon.ca</a><br><br>",As Needed,,https://yukon.maps.arcgis.com/home/item.html?id=7d50401a286a4e9e97e78faff688fefc,,ogly,2016-06-10T20:43:34.000Z,2021-01-03T21:22:33.000Z,Geomatics Yukon,https://yukon.maps.arcgis.com/sharing/rest/content/items/7d50401a286a4e9e97e78faff688fefc/info/metadata/metadata.xml,"-138.6496,60.0341,-134.9613,64.2269",Yukon,"Order-in-Council,Development Area Regulations,Regulation,Commissioner's Order,Withdrawal,O.I.C.,Yukon Government,Zoning,Area Development Act,Development Area Regulation,OIC,Regulations,Area Development Regulations,YTG,Planning,YG,Area Development Regulation,Order in Council,Yukon,GeoYukon",,,Land Use Designations Line,"Government and Politics,Nature and environment"
264,public,Yukon Geological Survey – Government of Yukon,mailto:Geomatics.Help@yukon.ca,Geomatics Yukon,Places,,," The Yukon is underlain by a great variety of rock types ranging in age from Early Proterozoic to Recent. The various rock types are characterized by different magnetic intensity and this map shows those variations at the regional scale, with highly magnetic rocks represented by warm colours and non-magnetic rocks shown in cool colours. The Residual Total Field magnetic map shows a measure of the total magnetic intensity in the Earth's crust. This magnetic compilation was extracted from the compilation of Oneschuk et al. (2019). The data was gridded at 50 m.<br><br>  Magnetic data for Yukon can be obtained from: <a href='http://gdrdap.agg.nrcan.gc.ca/' rel='nofollow ugc'>  http://gdrdap.agg.nrcan.gc.ca/</a><br><br>  Distributed from <a href='https://yukon.ca/geoyukon' rel='nofollow ugc'>  GeoYukon</a>  by the <a href='https://yukon.ca/maps' rel='nofollow ugc'>  Government of Yukon</a>  . Discover more digital map data and interactive maps from Yukon's digital map data collection.<br><br>  For more information: <a href='mailto:geomatics.help@yukon.ca' rel='nofollow ugc'>  geomatics.help@yukon.ca</a><br><br><br><br>",As Needed,,https://yukon.maps.arcgis.com/home/item.html?id=7d73a01036154f3eb3c5c0bbe5a71ea2,,ogly,2022-03-14T17:05:56.000Z,2022-03-19T20:23:31.000Z,Geomatics Yukon,https://yukon.maps.arcgis.com/sharing/rest/content/items/7d73a01036154f3eb3c5c0bbe5a71ea2/info/metadata/metadata.xml,"-144.6250,58.7544,-117.0118,69.8484",Yukon,"Canada,geology,earth science,bedrock geology,Yukon Territory,geophysics,magnetic data,Yukon,GeoYukon",,,Geophysics Residual Magnetic Total Fields - 50m,"Nature and environment,Science and Technology"
33,public,Geomatics Yukon – Government of Yukon,mailto:Geomatics.Help@yukon.ca,Geomatics Yukon,Places,,," This data set was created to give a general representation of Yukon's water features at 1:2,000,000 scale. The original source of this data is unknown.<br><br>  Distributed from <a href='https://yukon.ca/geoyukon' rel='nofollow ugc'>  GeoYukon</a>   by the <a href='https://yukon.ca/maps' rel='nofollow ugc'>  Government of Yukon</a>  . Discover more digital map data and interactive maps from Yukon's digital map data collection.<br><br>  For more information: <a href='mailto:geomatics.help@yukon.ca' rel='nofollow ugc'>  geomatics.help@yukon.ca</a><br><br><br><br>",As Needed,,https://yukon.maps.arcgis.com/home/item.html?id=7ed2f56f8ab24732aa569fb5e5c37cc6,,ogly,2016-06-10T17:27:36.000Z,2021-01-03T17:41:28.000Z,Geomatics Yukon,https://yukon.maps.arcgis.com/sharing/rest/content/items/7ed2f56f8ab24732aa569fb5e5c37cc6/info/metadata/metadata.xml,"-139.9897,59.7764,-126.7963,67.6765",Yukon,"hydrology,rivers,drainage,water,lakes,Yukon,GeoYukon",,,Water - 2M,Nature and environment
198,public,"Oil, Gas and Mineral Resources – Government of Yukon",mailto:Geomatics.Help@yukon.ca,Geomatics Yukon,Places,,," The extent of Sedimentary Rock as defined by Yukon Geological Survey, data is based on &quot;GSC Open File 4673&quot; .<br><br>  Distributed from <a href='https://yukon.ca/geoyukon' rel='nofollow ugc' style='text-decoration:underline;'>  GeoYukon</a>   by the <a href='https://yukon.ca/maps' rel='nofollow ugc' style='text-decoration:underline;'>  Government of Yukon</a>  . Discover more digital map data and interactive maps from Yukon's digital map data collection.<br><br>  <br><br>  For more information: <a href='mailto:geomatics.help@yukon.ca' rel='nofollow ugc' style='text-decoration:underline;'>  geomatics.help@yukon.ca</a><br><br>",As Needed,,https://yukon.maps.arcgis.com/home/item.html?id=7ed5939deac443d8810217c6408cf998,,ogly,2016-06-10T21:18:54.000Z,2021-01-03T22:15:01.000Z,Geomatics Yukon,https://yukon.maps.arcgis.com/sharing/rest/content/items/7ed5939deac443d8810217c6408cf998/info/metadata/metadata.xml,"-139.6543,59.7958,-119.7325,70.0673",Yukon,"Geology,Yukon,Oil and Gas,GeoYukon,infrastructure,Yukon,pit,quary,stock pile,borrow,Canada,GeoYukon",,,Sedimentary Extents - 1M,"Economics and Industry,Government and Politics"
316,public,Yukon Geological Survey – Government of Yukon,mailto:Geomatics.Help@yukon.ca,Geomatics Yukon,Places,,," Yukon Bedrock Geology MapThis update of the Yukon bedrock geology map builds upon the previous compilation by Gordey and Makepeace (1999, 2001). It includes new, detailed bedrock geology maps and regional compilations that have been published by the Yukon Geological Survey and the Geological Survey of Canada between 1999 and 2015, as well as some recent thesis works. A few of these maps were partially integrated into the digital dataset by Gordey and Makepeace (2003), but only as overlay to the 1999 compilation. A number of errors and omissions from the 1999 compilation of Gordey and Makepeace were also noted and corrected during compilation of this version of the map. The Yukon bedrock geology GIS dataset is regularly updated and can be downloaded from the Yukon Geological Survey's website: www.geology.gov.yk.ca. Users are advised to consult the website regularly to ensure they are working with the latest version of the geodatabase or shape files. This update of the GIS dataset includes an expanded attribute structure (compared to the 1999 dataset) that facilitates searching of the geodatabase. The Yukon Geological Survey aims to provide users with the best available geoscience data for Yukon. Any revisions or additional geological information known to the user would be welcomed by the Yukon Geological Survey.<br><br>  Distributed from <a href='https://yukon.ca/geoyukon' rel='nofollow ugc'>  GeoYukon</a>   by the <a href='https://yukon.ca/maps' rel='nofollow ugc'>  Government of Yukon</a>  . Discover more digital map data and interactive maps from Yukon's digital map data collection.<br><br>  For more information: <a href='mailto:geomatics.help@yukon.ca' rel='nofollow ugc'>  geomatics.help@yukon.ca</a><br><br>",As Needed,,https://yukon.maps.arcgis.com/home/item.html?id=8085a070842e493aadd19e66666e15ff,,ogly,2016-06-09T21:14:49.000Z,2023-10-10T17:37:02.000Z,Geomatics Yukon,https://yukon.maps.arcgis.com/sharing/rest/content/items/8085a070842e493aadd19e66666e15ff/info/metadata/metadata.xml,"-140.7560,59.7277,-119.7814,69.3164",Yukon,"contact,earth science,geology,Yukon,bedrock geology,Yukon Territory,Canada,GeoYukon,mining area,cultural,GeoYukon",,,Contacts,"Nature and environment,Science and Technology"
386,public,Department of Environment – Government of Yukon,mailto:Geomatics.Help@yukon.ca,Geomatics Yukon,Places,,," Each hexagon in this layer serves as a flag to indicate there is one or more mapped locations of a species that is subject to persecution or harm within the hexagon boundaries. Access to the precise locations are restricted, unless there is a demonstrable business need for the information. Users are asked to contact the Yukon Conservation Data Centre (<a href='mailto:yukoncdc@yukon.ca' rel='nofollow ugc'> yukoncdc@yukon.ca</a> ) to request access to precise locations and details on the species involved.<br><br> Distributed from <a target='_blank' href='https://yukon.ca/geoyukon' rel='nofollow ugc noopener noreferrer'> GeoYukon</a> by the <a target='_blank' href='https://yukon.ca/' rel='nofollow ugc noopener noreferrer'> Government of Yukon</a> . Discover more digital map data and interactive maps from Yukon's digital map data collection.<br><br> For more information: <a href='mailto:geomatics.help@yukon.ca' rel='nofollow ugc'> geomatics.help@yukon.ca</a><br><br>",As Needed,,https://yukon.maps.arcgis.com/home/item.html?id=8134850dfeb14b1a94775fb9b8aca183,,ogly,2021-06-26T17:28:24.000Z,2025-07-14T20:53:17.000Z,Geomatics Yukon,https://yukon.maps.arcgis.com/sharing/rest/content/items/8134850dfeb14b1a94775fb9b8aca183/info/metadata/metadata.xml,"-139.6124,59.7867,-127.3709,69.6969",Yukon,"Yukon,Conservation,Species at Risk,GeoYukon,Yukon Conservation Data Centre",,,CDC Species of Conservation Concern - Restricted,"Nature and environment,Science and Technology"
132,public,Land Planning Branch – Government of Yukon,mailto:Geomatics.Help@yukon.ca,Geomatics Yukon,Places,,," As of June, 2011, each parcel that is affected by a change in rezoning has the current OIC/MO. In some cases, OIC's and MO's are too numerous to mention therefore only the original OIC/MO along with the most current OIC/MO will show. The current OIC/MO may apply to any number of parcels within a Development Area Regulation Boundary. Municipal zoning changes are passed by 3rd reading of Bylaws. This data is updated within 1 week of passing a Bylaw, OIC, or MO.<br><br>  Distributed from <a href='https://yukon.ca/geoyukon' rel='nofollow ugc'>  GeoYukon</a>   by the <a href='https://yukon.ca/maps' rel='nofollow ugc'>  Government of Yukon</a>  . Discover more digital map data and interactive maps from Yukon's digital map data collection.<br><br>  For more information: <a href='mailto:geomatics.help@yukon.ca' rel='nofollow ugc'>  geomatics.help@yukon.ca</a><br><br>",As Needed,,https://yukon.maps.arcgis.com/home/item.html?id=838705a6bcd1485abf64dce2e9ba6662,,ogly,2016-06-10T20:11:15.000Z,2021-01-03T20:44:47.000Z,Geomatics Yukon,https://yukon.maps.arcgis.com/sharing/rest/content/items/838705a6bcd1485abf64dce2e9ba6662/info/metadata/metadata.xml,"-138.5788,59.8865,-132.3316,64.2471",Yukon,"Order-in-Council,Development Area Regulations,Regulation,Commissioner's Order,Withdrawal,O.I.C.,Yukon Government,Zoning,Area Development Act,Development Area Regulation,OIC,Regulations,Area Development Regulations,YTG,Planning,YG,Area Development Regulation,Order in Council,Yukon,GeoYukon",,,Community Zoning,"Government and Politics,Nature and environment"
97,public,Forest Management Branch – Government of Yukon,mailto:Geomatics.Help@yukon.ca,Geomatics Yukon,Places,,," The purpose of this feature class is to identify the individual annual allowable cut and annual limit areas as referred to in the Forest Resources Act subsection 20(2) and 31(10 of the Forest Resources Regulation). Where there is no approved Forest Resources Management Plan (FRMP) for an area, forest resources harvesting can only be authorized in an amount less than that prescribed by regulation for that area. The Forest Resources Regulation subsection 31(1) establishes the annual limits for harvesting timber resources for areas without an FRMP. These areas are referred to as the Annual Limit Regions in Schedule 1 of the Regulation titled Timber Harvesting Areas. These annual limits are set as the annual allowable cut for each of the areas, until such time as a Forest Resources Management Plan is approved for that area.<br><br>  Distributed from <a href='https://yukon.ca/geoyukon' rel='nofollow ugc'>  GeoYukon</a>   by the <a href='https://yukon.ca/maps' rel='nofollow ugc'>  Government of Yukon</a>  . Discover more digital map data and interactive maps from Yukon's digital map data collection.<br><br>  For more information: <a href='mailto:geomatics.help@yukon.ca' rel='nofollow ugc'>  geomatics.help@yukon.ca</a><br><br> <br><br>",As Needed,,https://yukon.maps.arcgis.com/home/item.html?id=840b9090fec942ce8fd9219fc7ec40e3,,ogly,2016-06-14T16:18:31.000Z,2021-01-03T20:06:27.000Z,Geomatics Yukon,https://yukon.maps.arcgis.com/sharing/rest/content/items/840b9090fec942ce8fd9219fc7ec40e3/info/metadata/metadata.xml,"-140.5976,59.7377,-120.1008,69.4183",Yukon,"limit,ceiling,timber,Yukon,harvest,forest,GeoYukon,Yukon Territory,YT,Canada",,,Forest Resources Management Plans - 250k,"Economics and Industry,Nature and environment"
74,public,Government of Canada; Natural Resources Canada; Earth Sciences Sector,mailto:Geomatics.Help@yukon.ca,Geomatics Yukon,Places,,," Transport Features is composed of, among others, the National Road Network (NRN) and the National Railway Network (NRWN). Transport Features entities are: Nautical Facility, Track Segment, Track Junction, Railway Station, Track Crossing, Track Marker Post, Track Structure, Rail Ferry, Road Segment, Road Ferry, Road Junction, Blocked Passage, Toll Point, Aerial Cableway, Footbridge, Trail, Navigational Aid, Marina, and Runway. CanVec is a digital cartographic reference product of Natural Resources Canada (NRCan). It originates from the best available data sources covering Canadian territory, offers quality topographical information in vector format and complies with international geomatics standards. CanVec is a multi-source product coming mainly from the National Topographic Data Base (NTDB), the Mapping the North process conducted by the Canada Center for Mapping and Earth Observation (CCMEO), the Atlas of Canada data, the GeoBase initiative and the data update using satellite imagery coverage (e.g. Landsat 7, Spot, Radarsat, etc.).<br><br>  Distributed from <a href='https://yukon.ca/geoyukon' rel='nofollow ugc' style='text-decoration:underline;'>  GeoYukon</a>   by the <a href='https://yukon.ca/maps' rel='nofollow ugc' style='text-decoration:underline;'>  Government of Yukon</a>  . Discover more digital map data and interactive maps from Yukon's digital map data collection.<br><br>  For more information: <a href='mailto:geomatics.help@yukon.ca' rel='nofollow ugc' style='text-decoration:underline;'>  geomatics.help@yukon.ca</a><br><br>",As Needed,,https://yukon.maps.arcgis.com/home/item.html?id=849b0e7d027748da87cc1d73b31e29cf,,ogly,2017-12-04T20:22:03.000Z,2021-01-03T19:01:23.000Z,Geomatics Yukon,https://yukon.maps.arcgis.com/sharing/rest/content/items/849b0e7d027748da87cc1d73b31e29cf/info/metadata/metadata.xml,"-140.0173,58.8080,-118.6685,68.9127",Yukon,"Earth Science,CanVec,Transport,Infrastructure,GeoYukon,Yukon,Reference,biota,Yukon,Yukon Territory",,,Road Junctions - 50k - Canvec,"Nature and environment,Science and Technology"
236,public,Department of Environment – Government of Yukon,mailto:Geomatics.Help@yukon.ca,Geomatics Yukon,Places,,," The Contaminated Sites dataset compiles  information on contamination collected by the Government of Yukon . Note: when a site has no information, the property is not necessarily not contaminated rather the data is not available.<br><br>  Distributed from <a href='https://yukon.ca/geoyukon' rel='nofollow ugc'>  GeoYukon</a>   by the <a href='https://yukon.ca/maps' rel='nofollow ugc'>  Government of Yukon</a>  . Discover more digital map data and interactive maps from Yukon's digital map data collection.<br><br>  For more information: <a href='mailto:geomatics.help@yukon.ca' rel='nofollow ugc'>  geomatics.help@yukon.ca</a><br><br>",As Needed,,https://yukon.maps.arcgis.com/home/item.html?id=85436480756748cb96664f7fad695bd8,,ogly,2019-05-29T16:32:01.000Z,2021-04-09T19:21:04.000Z,Geomatics Yukon,https://yukon.maps.arcgis.com/sharing/rest/content/items/85436480756748cb96664f7fad695bd8/info/metadata/metadata.xml,"179.2731,47.7398,-88.8595,87.1628",Yukon,"Contamination,Water,Soil,Environmental Monitoring,Water Quality,Drinking Water,Yukon,GeoYukon",,,Contaminated Sites,"Nature and environment,Science and Technology"
279,public,Mineral Resources Branch – Government of Yukon,mailto:Geomatics.Help@yukon.ca,Geomatics Yukon,Places,,," The Yukon government amended the Quartz Mining Act and the Placer Mining Actin December 2013, to establish the authority to designate areas where government notification of Class 1 exploration activities is required. Before these amendments to the mining acts and regulation came into effect, prospectors undertaking Class 1 activities were not required to inform government of their work. Class 1 exploration activities generally have low potential to cause adverse environmental effects. A Notification is required if an exploration program is categorized as class 1 (OIC 2003/59 and OIC 2003/64) and located either on settlement land (category A or B) or within a class 1 notification area (OIC 2013/221). This layer show current class 1 exploration program that are allowed to proceed.<br><br>  Distributed from <a href='https://yukon.ca/geoyukon' style='text-decoration:underline;' rel='nofollow ugc'>  GeoYukon</a>   by the <a href='https://yukon.ca/maps' style='text-decoration:underline;' rel='nofollow ugc'>  Government of Yukon</a>  . Discover more digital map data and interactive maps from Yukon's digital map data collection.<br><br>  For more information: <a href='mailto:geomatics.help@yukon.ca' style='text-decoration:underline;' rel='nofollow ugc'>  geomatics.help@yukon.ca</a><br><br>",As Needed,,https://yukon.maps.arcgis.com/home/item.html?id=854f3555fff04efaa209837b76bae4f0,,ogly,2020-01-17T18:48:28.000Z,2023-07-09T00:21:26.000Z,Geomatics Yukon,https://yukon.maps.arcgis.com/sharing/rest/content/items/854f3555fff04efaa209837b76bae4f0/info/metadata/metadata.xml,"-140.4276,59.7704,-124.0149,66.8142",Yukon,"Quartz,Mining,Placer,Class 1,Notification,Yukon,GeoYukon",,,Class 1 placer land use operations,"Economics and Industry,Nature and environment"
88,public,Government of Canada; Natural Resources Canada; Earth Sciences Sector,mailto:Geomatics.Help@yukon.ca,Geomatics Yukon,Places,,," Hydro Features is composed of the network of Canadian surface waters. Hydro Features entities are: Watercourse, Water Linear Flow, Hydro Obstacle (falls, rapids...), Waterbody (lake, watercourse...), Permanent Snow and Ice, Water Well, and Spring. CanVec is a digital cartographic reference product of Natural Resources Canada (NRCan). It originates from the best available data sources covering Canadian territory, offers quality topographical information in vector format, and complies with international geomatics standards. CanVec is a multi-source product coming mainly from the National Topographic Data Base (NTDB), the Mapping the North process conducted by the Canada Center for Mapping and Earth Observation (CCMEO), the Atlas of Canada data, the GeoBase initiative, and the data update using satellite imagery coverage (e.g. Landsat 7, Spot, Radarsat, etc.).<br><br>  Distributed from <a href='https://yukon.ca/geoyukon' rel='nofollow ugc' style='text-decoration:underline;'>  GeoYukon</a>   by the <a href='https://yukon.ca/maps' rel='nofollow ugc' style='text-decoration:underline;'>  Government of Yukon</a>  . Discover more digital map data and interactive maps from Yukon's digital map data collection.<br><br>  For more information: <a href='mailto:geomatics.help@yukon.ca' rel='nofollow ugc' style='text-decoration:underline;'>  geomatics.help@yukon.ca</a><br><br>",As Needed,,https://yukon.maps.arcgis.com/home/item.html?id=85c32a46759948bbbc42e4d4cb3b6d09,,ogly,2017-10-26T05:34:24.000Z,2021-01-03T19:15:45.000Z,Geomatics Yukon,https://yukon.maps.arcgis.com/sharing/rest/content/items/85c32a46759948bbbc42e4d4cb3b6d09/info/metadata/metadata.xml,"-139.9774,58.7873,-118.0572,68.9005",Yukon,"Earth Science,CanVec,Hydrography,GeoYukon,Yukon,Yukon,GeoYukon",,,Water Obstacles Point - 250k - Canvec,"Nature and environment,Science and Technology"
