ID,ACCESS,AUTHOR_NAME,CONTACT_EMAIL,CONTACT_NAME,DATA_DICTIONARY,DATA_DICTIONARY_TYPE,DATA_STANDARD,DESCRIPTION,FREQUENCY,GRANULARITY,HOMEPAGE,LANGUAGE,LICENSE,RELEASED_DATE,MODIFIED_DATE,PUBLISHER,RELATED_CONTENT,SPATIAL_COVERAGE_AREA,SPATIAL_COVERAGE_LOCATION,TAGS,TEMPORAL_COVERAGE_END,TEMPORAL_COVERAGE_START,TITLE,TOPICS
278,public,Mineral Resources Branch – Government of Yukon,mailto:Geomatics.Help@yukon.ca,Geomatics Yukon,Places,,," The Yukon government amended the Quartz Mining Act and the Placer Mining Actin December 2013, to establish the authority to designate areas where government notification of Class 1 exploration activities is required. Before these amendments to the mining acts and regulation came into effect, prospectors undertaking Class 1 activities were not required to inform government of their work. Class 1 exploration activities generally have low potential to cause adverse environmental effects. A Notification is required if an exploration program is categorized as class 1 (OIC 2003/59 and OIC 2003/64) and located either on settlement land (category A or B) or within a class 1 notification area (OIC 2013/221). This layer show current class 1 exploration program that are allowed to proceed.<br><br>  Distributed from <a href='https://yukon.ca/geoyukon' style='text-decoration:underline;' rel='nofollow ugc'>  GeoYukon</a>   by the <a href='https://yukon.ca/maps' style='text-decoration:underline;' rel='nofollow ugc'>  Government of Yukon</a>  . Discover more digital map data and interactive maps from Yukon's digital map data collection.<br><br>  For more information: <a href='mailto:geomatics.help@yukon.ca' style='text-decoration:underline;' rel='nofollow ugc'>  geomatics.help@yukon.ca</a><br><br>",As Needed,,https://yukon.maps.arcgis.com/home/item.html?id=bc218aecb3fa4c8e836a0cca770b4d61,,ogly,2020-01-17T18:58:55.000Z,2023-07-09T00:18:52.000Z,Geomatics Yukon,https://yukon.maps.arcgis.com/sharing/rest/content/items/bc218aecb3fa4c8e836a0cca770b4d61/info/metadata/metadata.xml,"-140.4276,59.7704,-124.0149,66.8142",Yukon,"Quartz,Mining,Placer,Class 1,Notification,Yukon,GeoYukon",,,Class 1 quartz land use operations,"Economics and Industry,Nature and environment"
194,public,Yukon Geological Survey – Government of Yukon,mailto:Geomatics.Help@yukon.ca,Geomatics Yukon,Places,,," Historic placer mining areas in Yukon can be grouped into ten areas: Klondike; Sixtymile; Fortymile; Clear Creek; Moosehorn Range; Stewart River; Whitehorse South; Mayo; Dawson Range and Livingstone Creek. Each area has its own geomorphic setting and depositional history which is related to its glacial history. Several Quaternary glacial advances have been described in Yukon, and these are generally divided into three episodes, commonly known as the pre-Reid, Reid and McConnell, in order of oldest to most recent.<br><br>  Distributed from <a href='https://yukon.ca/geoyukon' rel='nofollow ugc'>  GeoYukon</a>   by the <a href='https://yukon.ca/maps' rel='nofollow ugc'>  Government of Yukon</a>  . Discover more digital map data and interactive maps from Yukon's digital map data collection.<br><br>  For more information: <a href='mailto:geomatics.help@yukon.ca' rel='nofollow ugc'>  geomatics.help@yukon.ca</a><br><br> <br><br>",As Needed,,https://yukon.maps.arcgis.com/home/item.html?id=bc38fddb8e1140e995e25bf91354bc21,,ogly,2016-06-15T18:15:58.000Z,2021-01-03T22:06:41.000Z,Geomatics Yukon,https://yukon.maps.arcgis.com/sharing/rest/content/items/bc38fddb8e1140e995e25bf91354bc21/info/metadata/metadata.xml,"-140.4902,59.7452,-126.4067,69.2155",Yukon,"Yukon,placer geology,earth science,Yukon Territory,Canada,Y.T.,geology,GeoYukon",,,Placer Streams - 250k,"Nature and environment,Science and Technology"
182,public,"Oil, Gas and Mineral Resources – Government of Yukon",mailto:Geomatics.Help@yukon.ca,Geomatics Yukon,Places,,, Yukon Oil and Gas Rights Disposition Process. Call for Bids (CFB) - an invitation to submit bids for posted locations.  The Call for Bids dataset contains basic information on disposition process administered by Yukon Government. For more information on disposition process visit <a href='https://yukon.ca/en/doing-business/licensing/apply-oil-and-gas-rights' rel='nofollow ugc' style='text-decoration:underline;'> https://yukon.ca/en/doing-business/licensing/apply-oil-and-gas-rights#disposition-overview</a><br><br>  Distributed from <a href='https://yukon.ca/geoyukon' rel='nofollow ugc' style='text-decoration:underline;'>  GeoYukon</a>   by the <a href='https://yukon.ca/maps' rel='nofollow ugc' style='text-decoration:underline;'>  Government of Yukon</a>  . Discover more digital map data and interactive maps from Yukon's digital map data collection.<br><br>  For more information: <a href='mailto:geomatics.help@yukon.ca' rel='nofollow ugc' style='text-decoration:underline;'>  geomatics.help@yukon.ca</a><br><br>,As Needed,,https://yukon.maps.arcgis.com/home/item.html?id=bc5a6c35e2dd444e961e9d656fada280,,ogly,2016-06-10T21:13:48.000Z,2021-01-03T21:57:31.000Z,Geomatics Yukon,https://yukon.maps.arcgis.com/sharing/rest/content/items/bc5a6c35e2dd444e961e9d656fada280/info/metadata/metadata.xml,"-137.9644,65.7823,-134.3132,67.3798",Yukon,"Disposition process,Oil and Gas,Y.T.,Yukon,CFB,Rights management,Canada,Call for Bids,Petroleum,Yukon Territory,GeoYukon,Privy Council,Ministerial Order,Yukon,GeoYukon",,,Oil and Gas Bid Locations - 50k,"Economics and Industry,Nature and environment"
342,public,Lands - Government of Yukon,mailto:Geomatics.Help@yukon.ca,Geomatics Yukon,Places,,,"  Landscape Management Units for the 2019 Peel Watershed Regional Land Use Plan. For more information, please refer to <a href='https://yukon.ca/peel-watershed-regional-land-use-plan' rel='nofollow ugc' style='text-decoration:underline;'>  https://yukon.ca/peel-watershed-regional-land-use-plan</a><br><br>  Distributed from <a href='https://yukon.ca/geoyukon' rel='nofollow ugc' style='text-decoration:underline;'>  GeoYukon</a>   by the <a href='https://yukon.ca/maps' rel='nofollow ugc' style='text-decoration:underline;'>  Government of Yukon</a>  . Discover more digital map data and interactive maps from Yukon's digital map data collection.<br><br>  For more information: <a href='mailto:geomatics.help@yukon.ca' rel='nofollow ugc' style='text-decoration:underline;'>  geomatics.help@yukon.ca</a><br><br> <br><br>",As Needed,,https://yukon.maps.arcgis.com/home/item.html?id=bedb4e55cbb44db89800822547098f55,,ogly,2020-06-15T20:02:30.000Z,2025-06-25T01:12:58.000Z,Geomatics Yukon,https://yukon.maps.arcgis.com/sharing/rest/content/items/bedb4e55cbb44db89800822547098f55/info/metadata/metadata.xml,"-139.7458,63.9426,-130.9799,67.0342",Yukon,"Yukon,LMU,Peel,ecological,boundaries,land use,GeoYukon",,,Peel Landscape Management Units - 250k,"Government and Politics,Society and culture"
281,public,City of Whitehorse,mailto:Geomatics.Help@yukon.ca,Geomatics Yukon,Places,,," The Fire Response Boundary layer defines the geographic area for the primary providers of response services. This layer is used by the ECRF (Emergency Call Routing Function) to perform a geographic query to determine which Emergency Service Providers are responsible for providing service to a location in the event a selective transfer is desired, to direct an Emergency Incident Data Document to a secondary PSAP (Public Safety Answering Point) for dispatch, or to display the responsible agencies at the PSAP. In addition, Emergency Services Boundaries are used by PSAPs to identify the appropriate entities / first responders to be dispatched. <br><br> Data was modeled using the NENA NG9-1-1 GIS Data Template (NENA-REF-006. 2 -202 2 ).<br><br> Distributed from <a href='https://yukon.ca/geoyukon' style='text-decoration:underline;' rel='nofollow ugc'> GeoYukon</a>  by the <a href='https://yukon.ca/maps' style='text-decoration:underline;' rel='nofollow ugc'> Government of Yukon</a> . Discover more digital map data and interactive maps from Yukon's digital map data collection.<br><br> For more information: <a href='mailto:geomatics.help@yukon.ca' style='text-decoration:underline;' rel='nofollow ugc'> geomatics.help@yukon.ca</a><br><br>",As Needed,,https://yukon.maps.arcgis.com/home/item.html?id=c00d2072d77c4984b66cef011eb60580,,ogly,2022-10-13T18:24:01.000Z,2023-09-07T21:48:13.000Z,Geomatics Yukon,https://yukon.maps.arcgis.com/sharing/rest/content/items/c00d2072d77c4984b66cef011eb60580/info/metadata/metadata.xml,"-135.2508,60.5542,-134.8974,60.8524",Yukon,"GeoYukon,Yukon,NG911,emergency,city,Whitehorse,City of Whitehorse,fire,911,boundary,PSAP",,,NG911 Fire Response Boundary - Whitehorse,"Nature and environment,Science and Technology"
305,public,"Yukon Geological Survey, Government of Yukon",mailto:Geomatics.Help@yukon.ca,Geomatics Yukon,Places,,,"  The Yukon Geological Survey (YGS) has compiled over 195 surficial geology maps into a standardized GIS format, providing approximately 80% coverage of the territory. The maps range in scales from 1:250,000 to 1:10,000 with spatial overlap between scales. The original maps were produced by various agencies, including the Geological Survey of Canada, YGS, Yukon Government, universities, and the City of Whitehorse.<br><br>  All original feature descriptions have been preserved and also converted to standardized values using the Yukon terrain classification system. The compilation includes 4 GIS datasets and supporting documents available for download via <a href='https://data.geology.gov.yk.ca/Compilation/33' style='text-decoration:underline;' rel='nofollow ugc'>  YGS integrated data system</a>   (YGSIDS) or GeoYukon. A .lyr file is <a href='https://data.geology.gov.yk.ca/Compilation/33' style='text-decoration:underline;' rel='nofollow ugc'>  provided</a>   to symbolize feature classes and differentiate overlapping maps at different scales. Additionally, there is a surficial geology map index.<br><br>  The polygon attributes captured include surficial material, texture, age, surface expression, and geomorphological processes. <br><br>  Line features include geological contacts, glacial limits, glacial landforms (cirques, ar&ecirc;tes, eskers, meltwater channels, moraines), and non-glacial landforms (faults, lineaments, landslides, escarpments).<br><br>  Point features include field station, fossil and sample locations, glacial landforms (erratics, kames, kettles, drumlins, flutings), permafrost features (pingos, palsas, patterned ground, thermokarst depressions), and other non-glacial landforms (landslides, tors).<br><br>  The map index provides information on each map publication such as author, map title, map scale, publisher. <br><br>  These data are valuable for land-use applications in the territory, including: mineral and placer exploration, geotechnical engineering, infrastructure planning, granular resource assessments, permafrost modeling, agricultural assessments, forest management, and biophysical or ecological land classification.<br><br>  Distributed from <a href='https://yukon.ca/geoyukon' style='text-decoration:underline;' rel='nofollow ugc'>  GeoYukon</a>   by the <a href='https://yukon.ca/maps' style='text-decoration:underline;' rel='nofollow ugc'>  Government of Yukon</a>  . Discover more digital map data and interactive maps from Yukon's digital map data collection.<br><br>  For more information:<a href='mailto:geomatics.help@yukon.ca' style='text-decoration:underline;' rel='nofollow ugc'>  geomatics.help@yukon.ca</a><br><br><br><br>",As Needed,,https://yukon.maps.arcgis.com/home/item.html?id=c0a3609c166b4a959cbe9747dc8828c4,,ogly,2023-06-28T22:27:27.000Z,2023-09-26T23:37:21.000Z,Geomatics Yukon,https://yukon.maps.arcgis.com/sharing/rest/content/items/c0a3609c166b4a959cbe9747dc8828c4/info/metadata/metadata.xml,"-139.8279,56.5782,-120.3609,69.4562",Yukon,"Surficial Geology,Yukon Geological Survey,Yukon,mining recorder,mining,Y.T.,Canada,claims,GeoYukon",,,Surficial Geology Line Type 100k,"Nature and environment,Science and Technology"
151,public,NRCan - Canada Center for Cadastral Management,mailto:Geomatics.Help@yukon.ca,Geomatics Yukon,Places,,, Surveyed Land Parcel Boundaries consist of the lines required to form the boundaries of the Land Parcels. COGO attributes are associated to the lines and depict the adjusted framework of the cadastral fabric.<br><br>  Distributed from <a href='https://yukon.ca/geoyukon' rel='nofollow ugc'>  GeoYukon</a>   by the <a href='https://yukon.ca/maps' rel='nofollow ugc'>  Government of Yukon</a>  . Discover more digital map data and interactive maps from Yukon's digital map data collection.<br><br>  For more information: <a href='mailto:geomatics.help@yukon.ca' rel='nofollow ugc'>  geomatics.help@yukon.ca</a><br><br><br><br>,As Needed,,https://yukon.maps.arcgis.com/home/item.html?id=c135f219543d4b2fa3dff1a5b6a3e797,,ogly,2016-06-14T18:35:13.000Z,2021-01-03T21:06:34.000Z,Geomatics Yukon,https://yukon.maps.arcgis.com/sharing/rest/content/items/c135f219543d4b2fa3dff1a5b6a3e797/info/metadata/metadata.xml,"-140.8468,59.7230,-120.4820,69.4461",Yukon,"Parcel,Survey,COGO,Yukon,Cadastral,Lot,GeoYukon,Boundary,Subdivision Control,YTG,Bdry,Regulations,Zoning,Commissioner's Order,Area Development Regulation,Planning,Regulation,OIC,Development Area Regulations,O.I.C.,Withdrawal,Order-in-Council,Order in Council,Yukon,GeoYukon",,,Land Parcels Line - Surveyed,"Government and Politics,Nature and environment"
313,public,Geomatics Yukon – Government of Yukon,mailto:Geomatics.Help@yukon.ca,Geomatics Yukon,Places,,," Yukon parks and protected areas captured using the National Topographic Base (NTDB) 1:250,000 scale dataset. Boundaries were generalized from survey information captured by Legal Survey Division of Natural Resources Canada (NRCan).<br><br>  Distributed from <a href='https://yukon.ca/geoyukon' rel='nofollow ugc'>  GeoYukon</a>   by the <a href='https://yukon.ca/maps' rel='nofollow ugc'>  Government of Yukon</a>  . Discover more digital map data and interactive maps from Yukon's digital map data collection.<br><br>  For more information: <a href='mailto:geomatics.help@yukon.ca' rel='nofollow ugc'>  geomatics.help@yukon.ca</a><br><br>",As Needed,,https://yukon.maps.arcgis.com/home/item.html?id=c1f7b78a9fde46529401c66e8f1168c2,,ogly,2016-06-10T21:41:40.000Z,2023-09-27T23:08:01.000Z,Geomatics Yukon,https://yukon.maps.arcgis.com/sharing/rest/content/items/c1f7b78a9fde46529401c66e8f1168c2/info/metadata/metadata.xml,"-140.8462,59.7267,-125.1583,69.6971",Yukon,"National Environment Park,Y.T.,Wildlife Sanctuary,Ecological Reserve,National Wildlife Area,conservation,Protected Areas,Habitat Protection Area,Wilderness Preserve,Yukon,Territorial Park,National Park,Yukon Territory,Parks,Special Management Areas,GeoYukon",,,Park and Protected Areas - 250k,"Nature and environment,Science and Technology"
212,public,Wildland Fire Management - Government of Yukon,mailto:Geomatics.Help@yukon.ca,Geomatics Yukon,Places,,, Fire districts are administrative areas where wildland fire resources are allocated and deployed. They fall within one of six larger fire regions.<br><br>  Distributed from <a href='https://yukon.ca/geoyukon' rel='nofollow ugc'>  GeoYukon</a>   by the <a href='https://yukon.ca/maps' rel='nofollow ugc'>  Government of Yukon</a>  . Discover more digital map data and interactive maps from Yukon's digital map data collection.<br><br>  For more information: <a href='mailto:geomatics.help@yukon.ca' rel='nofollow ugc'>  geomatics.help@yukon.ca</a><br><br>,As Needed,,https://yukon.maps.arcgis.com/home/item.html?id=c23a5f55cc734f34ae99ddfc8b133d0a,,ogly,2020-05-06T20:25:52.000Z,2021-01-03T22:41:48.000Z,Geomatics Yukon,https://yukon.maps.arcgis.com/sharing/rest/content/items/c23a5f55cc734f34ae99ddfc8b133d0a/info/metadata/metadata.xml,"-140.8450,59.7219,-120.1070,69.4185",Yukon,"forest fire,Yukon Territory,Canada,Fire History,Y.T.,environment,polygon,fire ignition,Fire,Yukon,GeoYukon",,,Fire Districts,"Nature and environment,Science and Technology"
47,public,Yukon Energy Corporation,mailto:Geomatics.Help@yukon.ca,Geomatics Yukon,Places,,," YEC Power Distribution Lines depict Yukon Energy Corporation (YEC) primary distribution lines. These lines distribute lower voltage electrical power between Power Substations and consumers (e.g. communities, mines). This data was provided by YEC and will be updated when new  primary distribution  lines are constructed.<br><br>  Distributed from <a href='https://yukon.ca/geoyukon' rel='nofollow ugc'>  GeoYukon</a>   by the <a href='https://yukon.ca/maps' rel='nofollow ugc'>  Government of Yukon</a>  . Discover more digital map data and interactive maps from Yukon's digital map data collection.<br><br>  For more information: <a href='mailto:geomatics.help@yukon.ca' rel='nofollow ugc'>  geomatics.help@yukon.ca</a><br><br> <br><br>",As Needed,,https://yukon.maps.arcgis.com/home/item.html?id=c271094c3c4a4c949fec8230130b5601,,ogly,2019-11-21T21:41:36.000Z,2021-01-03T18:12:32.000Z,Geomatics Yukon,https://yukon.maps.arcgis.com/sharing/rest/content/items/c271094c3c4a4c949fec8230130b5601/info/metadata/metadata.xml,"-137.5164,60.7575,-132.4560,62.7260",Yukon,"Energy,Power,Transmission,Yukon,energy,distribution,electric,GeoYukon,image,GeoYukon",,,YEC Power distribution lines,"Science and Technology,Nature and environment"
162,public,Land Planning Branch – Government of Yukon,mailto:Geomatics.Help@yukon.ca,Geomatics Yukon,Places,,," The Local Area Plans and Community Plans are approved by Minister of Energy, Mines and Resources and Cabinet as a Policy Document.  Newer joint Local Area Plans are approved in the same manner for non Settlement Land and by First Nation Chief and Council for Settlement Land.<br><br>  Distributed from <a href='https://yukon.ca/geoyukon' rel='nofollow ugc'>  GeoYukon</a>   by the <a href='https://yukon.ca/maps' rel='nofollow ugc'>  Government of Yukon</a>  . Discover more digital map data and interactive maps from Yukon's digital map data collection.<br><br>  For more information: <a href='mailto:geomatics.help@yukon.ca' rel='nofollow ugc'>  geomatics.help@yukon.ca</a><br><br>",As Needed,,https://yukon.maps.arcgis.com/home/item.html?id=c3497dbec5f74be4bef8767cb2ca3e90,,ogly,2016-06-10T20:47:21.000Z,2021-01-03T21:23:12.000Z,Geomatics Yukon,https://yukon.maps.arcgis.com/sharing/rest/content/items/c3497dbec5f74be4bef8767cb2ca3e90/info/metadata/metadata.xml,"-140.2470,59.9341,-132.4312,64.2607",Yukon,"Order-in-Council,Development Area Regulations,Regulation,Commissioner's Order,Withdrawal,O.I.C.,Yukon Government,Zoning,Area Development Act,Development Area Regulation,OIC,Regulations,Area Development Regulations,YTG,Planning,YG,Area Development Regulation,Order in Council,Yukon,GeoYukon",,,Land Use Designations Polygon,"Government and Politics,Nature and environment"
62,public,Government of Canada; Natural Resources Canada; Earth Sciences Sector,mailto:Geomatics.Help@yukon.ca,Geomatics Yukon,Places,,," Elevation Features entities are: Contour and Elevation Point. CanVec is a digital cartographic reference product of Natural Resources Canada (NRCan). It originates from the best available data sources covering Canadian territory, offers quality topographical information in vector format, and complies with international geomatics standards. CanVec is a multi-source product coming mainly from the National Topographic Data Base (NTDB), the Mapping the North process conducted by the Canada Center for Mapping and Earth Observation (CCMEO), the Atlas of Canada data, the GeoBase initiative, and the data update using satellite imagery coverage (e.g. Landsat 7, Spot, Radarsat, etc.).<br><br>  Distributed from <a href='https://yukon.ca/geoyukon' rel='nofollow ugc' style='text-decoration:underline;'>  GeoYukon</a>   by the <a href='https://yukon.ca/maps' rel='nofollow ugc' style='text-decoration:underline;'>  Government of Yukon</a>  . Discover more digital map data and interactive maps from Yukon's digital map data collection.<br><br>  For more information: <a href='mailto:geomatics.help@yukon.ca' rel='nofollow ugc' style='text-decoration:underline;'>  geomatics.help@yukon.ca</a><br><br>",As Needed,,https://yukon.maps.arcgis.com/home/item.html?id=c37de6eb6c74438a82a5242ec0ba2e9c,,ogly,2017-10-23T04:28:36.000Z,2021-01-03T18:49:55.000Z,Geomatics Yukon,https://yukon.maps.arcgis.com/sharing/rest/content/items/c37de6eb6c74438a82a5242ec0ba2e9c/info/metadata/metadata.xml,"-140.5951,58.7298,-117.2268,69.1368",Yukon,"Earth Science,CanVec,Relief and landforms,Contours,Elevation,GeoYukon,Yukon,biota,Yukon,Yukon Territory",,,Contours - 50k - Canvec,"Nature and environment,Science and Technology"
125,public,Yukon Geological Survey – Government of Yukon,mailto:Geomatics.Help@yukon.ca,Geomatics Yukon,Places,,," Landscape hazard maps were completed as part of a community hazards mapping program coordinated by the Northern Climate ExChange (Yukon Research Centre, Yukon College). Potential landscape hazards were assessed under changing future conditions by incorporating a variety of data sets, including surficial geology, topography (slope and aspect), permafrost distribution, site-specific permafrost data (e.g. ground penetrating radar, electrical resistivity tomography and borehole data), analyses of past hydrological and climatological trends, and future climate projections. The landscape hazard map identifies existing and potential geological hazards such as landslides, permafrost stability and flooding. The hazard map is presented in stoplight colours to provide an intuitive tool for community decision makers aiming to incorporate an adaptation planning framework into existing land use management practices. Detailed descriptions of data inputs and hazard analysis methodology are presented in an accompanying report (available for download from <a href='https://data.geology.gov.yk.ca/Reference/50310' rel='nofollow ugc' style='text-decoration:underline;'>  https://data.geology.gov.yk.ca/Reference/50310</a> ). An accompanying surficial geological map also describes detailed landscape characteristics such as surface landscape features, sediment texture, genetic material, surface expression and geomorphological processes (available for download from <a href='https://data.geology.gov.yk.ca/Reference/50310' rel='nofollow ugc' style='text-decoration:underline;'>  https://data.geology.gov.yk.ca/Reference/50310</a> ).<br><br>  Distributed from <a href='https://yukon.ca/geoyukon' rel='nofollow ugc' style='text-decoration:underline;'>  GeoYukon</a>   by the <a href='https://yukon.ca/maps' rel='nofollow ugc' style='text-decoration:underline;'>  Government of Yukon</a>  . Discover more digital map data and interactive maps from Yukon's digital map data collection.<br><br>  For more information: <a href='mailto:geomatics.help@yukon.ca' rel='nofollow ugc' style='text-decoration:underline;'>  geomatics.help@yukon.ca</a><br><br>",As Needed,,https://yukon.maps.arcgis.com/home/item.html?id=c40baaeeadbb4f8d8f0fb5b50e2c0412,,ogly,2017-02-14T21:36:23.000Z,2021-01-03T20:37:46.000Z,Geomatics Yukon,https://yukon.maps.arcgis.com/sharing/rest/content/items/c40baaeeadbb4f8d8f0fb5b50e2c0412/info/metadata/metadata.xml,"-136.7057,62.7444,-136.5017,62.8601",Yukon,"hazard,landscape hazard,geohazard,surficial geology,landslides,permafrost,hydrology,climate change,geomorphology,Yukon,GeoYukon",,,Community Hazards - Pelly Crossing - 20k,"Nature and environment,Science and Technology"
83,public,Government of Canada; Natural Resources Canada; Earth Sciences Sector,mailto:Geomatics.Help@yukon.ca,Geomatics Yukon,Places,,," Land Features entities are: Island, Shoreline, Wooded Area, Saturated soil, Landform Feature (esker, sand...), and Cut Line. CanVec is a digital cartographic reference product of Natural Resources Canada (NRCan). It originates from the best available data sources covering Canadian territory, offers quality topographical information in vector format, and complies with international geomatics standards. CanVec is a multi-source product coming mainly from the National Topographic Data Base (NTDB), the Mapping the North process conducted by the Canada Center for Mapping and Earth Observation (CCMEO), the Atlas of Canada data, the GeoBase initiative, and the data update using satellite imagery coverage (e.g. Landsat 7, Spot, Radarsat, etc.).<br><br>  Distributed from <a href='https://yukon.ca/geoyukon' rel='nofollow ugc' style='text-decoration:underline;'>  GeoYukon</a>   by the <a href='https://yukon.ca/maps' rel='nofollow ugc' style='text-decoration:underline;'>  Government of Yukon</a>  . Discover more digital map data and interactive maps from Yukon's digital map data collection.<br><br>  For more information: <a href='mailto:geomatics.help@yukon.ca' rel='nofollow ugc' style='text-decoration:underline;'>  geomatics.help@yukon.ca</a><br><br>",As Needed,,https://yukon.maps.arcgis.com/home/item.html?id=c4c6b41da30d4b738c721d2b8af85587,,ogly,2017-11-04T00:11:37.000Z,2021-01-03T19:08:12.000Z,Geomatics Yukon,https://yukon.maps.arcgis.com/sharing/rest/content/items/c4c6b41da30d4b738c721d2b8af85587/info/metadata/metadata.xml,"-140.2147,58.7579,-117.2360,69.1707",Yukon,"Earth Science,CanVec,Land,GeoYukon,Yukon,biology,vegetation,ecology,GeoYukon",,,Waterbody Islands - 50k - Canvec,"Nature and environment,Science and Technology"
