ID,ACCESS,AUTHOR_NAME,CONTACT_EMAIL,CONTACT_NAME,DATA_DICTIONARY,DATA_DICTIONARY_TYPE,DATA_STANDARD,DESCRIPTION,FREQUENCY,GRANULARITY,HOMEPAGE,LANGUAGE,LICENSE,RELEASED_DATE,MODIFIED_DATE,PUBLISHER,RELATED_CONTENT,SPATIAL_COVERAGE_AREA,SPATIAL_COVERAGE_LOCATION,TAGS,TEMPORAL_COVERAGE_END,TEMPORAL_COVERAGE_START,TITLE,TOPICS
217,public,"Departmental Library, Energy, Mines & Resources, Government of Yukon",mailto:Geomatics.Help@yukon.ca,Geomatics Yukon,Places,,, Location of centre points of Yukon aerial photographs. Data was produced from heads up digitization of paper flightline index maps<br><br>  Distributed from <a href='https://yukon.ca/geoyukon' rel='nofollow ugc'>  GeoYukon</a>   by the <a href='https://yukon.ca/maps' rel='nofollow ugc'>  Government of Yukon</a>  . Discover more digital map data and interactive maps from Yukon's digital map data collection.<br><br>  For more information: <a href='mailto:geomatics.help@yukon.ca' rel='nofollow ugc'>  geomatics.help@yukon.ca</a><br><br>,As Needed,,https://yukon.maps.arcgis.com/home/item.html?id=456ce90495604cb191c2d496a15bb14d,,ogly,2016-07-17T01:06:20.000Z,2021-01-08T16:44:30.000Z,Geomatics Yukon,https://yukon.maps.arcgis.com/sharing/rest/content/items/456ce90495604cb191c2d496a15bb14d/info/metadata/metadata.xml,"-141.2867,59.1613,-117.4883,69.2826",Yukon,"aerial,Yukon,air photo,photographs,GeoYukon",,,Air photo locations 1951 to 1960,"Nature and environment,Science and Technology"
388,public,{{source}},{{orgContactEmail}},Geomatics Yukon,Places,,,{{description}},As Needed,,https://yukon.maps.arcgis.com/home/item.html?id=45cbbe89dfa244b9985fc58b08e69f35,,ogly,2023-08-14T23:33:34.000Z,{{modified:toISO}},Geomatics Yukon,https://yukon.maps.arcgis.com/sharing/rest/content/items/45cbbe89dfa244b9985fc58b08e69f35/info/metadata/metadata.xml,{{extent:computeSpatialProperty}},Yukon,"transportation,airport,land tenure,aviation,GeoYukon",,,{{name}},Transport
197,public,Department of Highways and Public Works – Government of Yukon,mailto:Geomatics.Help@yukon.ca,Geomatics Yukon,Places,,, The purpose of this dataset is to provide structural culvert locations along highways . The definition of a Structural Culvert is a culvert with span of 2 metres or greater.   Drainage culverts have a diameter less than 2 metres and are not included in this dataset. <br><br>  Distributed from <a href='https://yukon.ca/geoyukon' rel='nofollow ugc'>  GeoYukon</a>   by the <a href='https://yukon.ca/maps' rel='nofollow ugc'>  Government of Yukon</a>  . Discover more digital map data and interactive maps from Yukon's digital map data collection.<br><br>  For more information: <a href='mailto:geomatics.help@yukon.ca' rel='nofollow ugc'>  geomatics.help@yukon.ca</a><br><br>,As Needed,,https://yukon.maps.arcgis.com/home/item.html?id=46979633b91f47a9a58f8195104d96bc,,ogly,2018-04-06T18:00:18.000Z,2021-01-03T22:14:14.000Z,Geomatics Yukon,https://yukon.maps.arcgis.com/sharing/rest/content/items/46979633b91f47a9a58f8195104d96bc/info/metadata/metadata.xml,"-140.1062,59.2816,-127.3002,66.9939",Yukon,"infrastructure,watercourse,transportation,Canada,Yukon,culvert,structural culvert,GeoYukon",,,Structural Culverts - 25k,Transport
213,public,"Forest Management branch, Dept. of Energy, Mines and Resources, Yukon Government",mailto:Geomatics.Help@yukon.ca,Geomatics Yukon,Places,,, This table is a list of polygon attributes to be used in map production for the vegetation Inventory map series. It contains attribute information for polygons in the inventory that are not labeled with the Inventory Annotation. Attribute information is pulled from this table to use as additional labels on the map layout for the Forest Inventory map series.<br><br> Distributed from <a href='https://yukon.ca/geoyukon' rel='nofollow ugc' style='text-decoration:underline;'>  GeoYukon</a>   by the <a href='https://yukon.ca/maps' rel='nofollow ugc' style='text-decoration:underline;'>  Government of Yukon</a>  . Discover more digital map data and interactive maps from Yukon's digital map data collection.<br><br>  For more information: <a href='mailto:geomatics.help@yukon.ca' rel='nofollow ugc' style='text-decoration:underline;'>  geomatics.help@yukon.ca</a><br><br>,As Needed,,https://yukon.maps.arcgis.com/home/item.html?id=46fa66d927ed4caf8daee29a9f38588a,,ogly,2016-06-14T17:35:20.000Z,2021-01-04T18:25:13.000Z,Geomatics Yukon,https://yukon.maps.arcgis.com/sharing/rest/content/items/46fa66d927ed4caf8daee29a9f38588a/info/metadata/metadata.xml,"-140.2034,59.7830,-121.0802,67.5738",Yukon,"yukon,inventory,Yukon,label,annotation,forestry,GeoYukon,GeoYukon",,,Forest Inventory Label Additional Table,"Economics and Industry,Nature and environment"
228,public,"Departmental Library, Energy, Mines & Resources, Government of Yukon",mailto:Geomatics.Help@yukon.ca,Geomatics Yukon,Places,,, Location of flight lines of Yukon aerial photographs. Data was produced from heads up digitization of paper flight line index maps .<br><br>  Distributed from <a href='https://yukon.ca/geoyukon' rel='nofollow ugc'>  GeoYukon</a>   by the <a href='https://yukon.ca/maps' rel='nofollow ugc'>  Government of Yukon</a>  . Discover more digital map data and interactive maps from Yukon's digital map data collection.<br><br>  For more information: <a href='mailto:geomatics.help@yukon.ca' rel='nofollow ugc'>  geomatics.help@yukon.ca</a><br><br>,As Needed,,https://yukon.maps.arcgis.com/home/item.html?id=483cbca7728d4380820186c7c530e27c,,ogly,2019-11-01T18:29:31.000Z,2021-01-08T16:52:20.000Z,Geomatics Yukon,https://yukon.maps.arcgis.com/sharing/rest/content/items/483cbca7728d4380820186c7c530e27c/info/metadata/metadata.xml,"-140.8012,59.1952,-117.4883,69.2826",Yukon,"aerial,Yukon,flight line,air photo,photographs,GeoYukon",,,Flight lines 2011 to current,"Nature and environment,Science and Technology"
32,public,Geomatics Yukon – Government of Yukon,mailto:Geomatics.Help@yukon.ca,Geomatics Yukon,Places,,, World UTM Zones represents the Universal Transverse Mercator (UTM) Zones of the world.<br><br>  Distributed from <a href='https://yukon.ca/geoyukon' rel='nofollow ugc'>  GeoYukon</a>   by the <a href='https://yukon.ca/maps' rel='nofollow ugc'>  Government of Yukon</a>  . Discover more digital map data and interactive maps from Yukon's digital map data collection.<br><br>  For more information: <a href='mailto:geomatics.help@yukon.ca' rel='nofollow ugc'>  geomatics.help@yukon.ca</a><br><br>,As Needed,,https://yukon.maps.arcgis.com/home/item.html?id=488c3876d6bf47599c19d60f56b1cf20,,ogly,2016-06-14T20:46:21.000Z,2021-01-03T17:40:44.000Z,Geomatics Yukon,https://yukon.maps.arcgis.com/sharing/rest/content/items/488c3876d6bf47599c19d60f56b1cf20/info/metadata/metadata.xml,"-143.8157,55.4181,-110.5403,71.1524",Yukon,"location,utm,polygon,universal transverse mercator,zones,Yukon,GeoYukon,McQuesten Watershed,ELC,Ecological,Land Classification,Landscape Classification,Ecological and Landscape Classification,Vegetation,Ecosystem,Environment Yukon,Yukon Territory,Yukon,YT,Canada",,,UTM Zones,"Nature and environment,Science and Technology"
314,public,Geomatics Yukon – Government of Yukon,mailto:Geomatics.Help@yukon.ca,Geomatics Yukon,Places,,," Yukon parks and protected areas captured from DCW 1:1,000,000 scale dataset. Boundaries were generalized from survey information captured by Legal Survey Division of Natural Resources Canada (NRCan).<br><br>  Distributed from <a href='https://yukon.ca/geoyukon' rel='nofollow ugc'>  GeoYukon</a>   by the <a href='https://yukon.ca/maps' rel='nofollow ugc'>  Government of Yukon</a>  . Discover more digital map data and interactive maps from Yukon's digital map data collection. <br><br>  For more information: <a href='mailto:geomatics.help@yukon.ca' rel='nofollow ugc'>  geomatics.help@yukon.ca</a><br><br>",As Needed,,https://yukon.maps.arcgis.com/home/item.html?id=48e15f2c3b01408e93d5d0ca5b04a4ed,,ogly,2016-06-10T21:44:43.000Z,2023-09-27T23:08:44.000Z,Geomatics Yukon,https://yukon.maps.arcgis.com/sharing/rest/content/items/48e15f2c3b01408e93d5d0ca5b04a4ed/info/metadata/metadata.xml,"-140.8481,59.7264,-125.1627,69.6970",Yukon,"National Environment Park,Y.T.,Ecological Reserve,National Wildlife Area,Protected Areas,Habitat Protection Area,Wilderness Preserve,Yukon,Wildlife Sanctuary,Territorial Park,National Park,Yukon Territory,Parks,Special Management Areas,GeoYukon",,,Park and Protected Areas - 1M,"Nature and environment,Science and Technology"
27,public,Geomatics Yukon – Government of Yukon,mailto:Geomatics.Help@yukon.ca,Geomatics Yukon,Places,,," Index of 1:250,000 NTS tiles<br><br>  Distributed from <a href='https://yukon.ca/geoyukon' rel='nofollow ugc'>  GeoYukon</a>   by the <a href='https://yukon.ca/maps' rel='nofollow ugc'>  Government of Yukon</a>  . Discover more digital map data and interactive maps from Yukon's digital map data collection.<br><br>  For more information: <a href='mailto:geomatics.help@yukon.ca' rel='nofollow ugc'>  geomatics.help@yukon.ca</a><br><br>",As Needed,,https://yukon.maps.arcgis.com/home/item.html?id=48efee5b15db4547bb4c60a1db5614ad,,ogly,2016-06-14T20:34:36.000Z,2021-01-03T17:19:21.000Z,Geomatics Yukon,https://yukon.maps.arcgis.com/sharing/rest/content/items/48efee5b15db4547bb4c60a1db5614ad/info/metadata/metadata.xml,"-140.5956,58.7298,-116.9478,69.5283",Yukon,"NTS index,NTS tiles,Yukon,GeoYukon,National Wildlife Area,conservation,Protected Areas,Habitat Protection Area,Wilderness Preserve,Yukon,Territorial Park,National Park,Yukon Territory,Parks,Special Management Areas,GeoYukon",,,NTS Index - 250k,Nature and environment
115,public,Forest Management Branch – Government of Yukon,mailto:Geomatics.Help@yukon.ca,Geomatics Yukon,Places,,," The roads and linear features in this data set were compiled and interpreted in association with the Vegetation Inventory (1995-2006). It is a representation of various linear features on the land base. The linear features were classified by the interpreters based on the NTDB classification system for roads and trails, at that time. When used in conjunction with other road or linear transportation networks, there may be duplication of lines and information.<br><br>  Distributed from <a href='https://yukon.ca/geoyukon' rel='nofollow ugc'>  GeoYukon</a>   by the <a href='https://yukon.ca/maps' rel='nofollow ugc'>  Government of Yukon</a>  . Discover more digital map data and interactive maps from Yukon's digital map data collection.<br><br>  For more information: <a href='mailto:geomatics.help@yukon.ca' rel='nofollow ugc'>  geomatics.help@yukon.ca</a><br><br>",As Needed,,https://yukon.maps.arcgis.com/home/item.html?id=48f1a110f59a4560ab1b58000250715e,,ogly,2016-06-14T17:10:58.000Z,2021-01-03T20:28:31.000Z,Geomatics Yukon,https://yukon.maps.arcgis.com/sharing/rest/content/items/48f1a110f59a4560ab1b58000250715e/info/metadata/metadata.xml,"-140.4809,61.0367,-128.4461,67.8611",Yukon,"forest,linear,network,Yukon,road,GeoYukon,canada,fault,GeoYukon",,,Vegetation Inventory Roads - 40k,"Economics and Industry,Nature and environment"
200,public,Department of Highways and Public Works – Government of Yukon,mailto:Geomatics.Help@yukon.ca,Geomatics Yukon,Places,,," The purpose of this dataset is to provide maintained runway locations as points. These points are the centroids of the Runway_Poly_25k dataset. Runways include airports, aerodromes, and airstrips managed by Transportation Aviation Yukon.  The latitude and longitude locations in the table are based on the centroid of the runway.<br><br>  Distributed from <a href='https://yukon.ca/geoyukon' rel='nofollow ugc'>  GeoYukon</a>   by the <a href='https://yukon.ca/maps' rel='nofollow ugc'>  Government of Yukon</a>  . Discover more digital map data and interactive maps from Yukon's digital map data collection.<br><br>  For more information: <a href='mailto:geomatics.help@yukon.ca' rel='nofollow ugc'>  geomatics.help@yukon.ca</a><br><br>",As Needed,,https://yukon.maps.arcgis.com/home/item.html?id=48fd1cb27fe74eb4a0e4b4a268fdd638,,ogly,2018-03-13T20:48:53.000Z,2021-01-03T22:16:37.000Z,Geomatics Yukon,https://yukon.maps.arcgis.com/sharing/rest/content/items/48fd1cb27fe74eb4a0e4b4a268fdd638/info/metadata/metadata.xml,"-140.1373,59.6086,-127.1929,67.6476",Yukon,"Canada,transportation,Yukon,runway,infrastructure,airport,aerodrome,airstrip,GeoYukon,Yukon Territory,GeoYukon",,,Runway Points - 25k,Transport
87,public,Government of Canada; Natural Resources Canada; Earth Sciences Sector,mailto:Geomatics.Help@yukon.ca,Geomatics Yukon,Places,,," Elevation Features entities are: Contour and Elevation Point. CanVec is a digital cartographic reference product of Natural Resources Canada (NRCan). It originates from the best available data sources covering Canadian territory, offers quality topographical information in vector format, and complies with international geomatics standards. CanVec is a multi-source product coming mainly from the National Topographic Data Base (NTDB), the Mapping the North process conducted by the Canada Center for Mapping and Earth Observation (CCMEO), the Atlas of Canada data, the GeoBase initiative, and the data update using satellite imagery coverage (e.g. Landsat 7, Spot, Radarsat, etc.).<br><br>  Distributed from <a href='https://yukon.ca/geoyukon' rel='nofollow ugc' style='text-decoration:underline;'>  GeoYukon</a>   by the <a href='https://yukon.ca/maps' rel='nofollow ugc' style='text-decoration:underline;'>  Government of Yukon</a>  . Discover more digital map data and interactive maps from Yukon's digital map data collection.<br><br>  For more information: <a href='mailto:geomatics.help@yukon.ca' rel='nofollow ugc' style='text-decoration:underline;'> geomatics.help@gov.yk. ca</a><br><br>",As Needed,,https://yukon.maps.arcgis.com/home/item.html?id=49bd95d009e642369c2a51505f9c2871,,ogly,2017-10-23T04:05:04.000Z,2021-01-03T19:15:01.000Z,Geomatics Yukon,https://yukon.maps.arcgis.com/sharing/rest/content/items/49bd95d009e642369c2a51505f9c2871/info/metadata/metadata.xml,"-140.2645,58.7930,-117.6996,69.2097",Yukon,"Earth Science,CanVec,Relief and landforms,Contours,Elevation,GeoYukon,Yukon",,,Elevation Points - 250k - Canvec,"Nature and environment,Science and Technology"
378,public,Yukon Geological Survey – Government of Yukon,mailto:Geomatics.Help@yukon.ca,Geomatics Yukon,Places,,," The Yukon Mining Assessment Report Footprints database contains over 7,500 reports documenting mineral exploration activity in Yukon since the 1950s. The majority fo these records are open to the public, more recent reports are confidential. Each record in this database represents a report, with the polygon geometry representing the area where work was performed. Key information about these reports has been captured, such as report number, title, author, year, claims, property name, expenditures, as well as a hyperlink to the scanned report, and it""s associated data. The intended audience for this dataset is mining companies, prospectors, land use planners, First Nations, regulators, Yukon Environmental and Socio-Economic Assessment Board, Yukon Geological Survey, and Yukon Government.<br><br><p style='margin:0;'> Distributed from <a target='_blank' href='https://yukon.ca/geoyukon' rel='nofollow ugc noopener noreferrer'> GeoYukon</a>  by the <a target='_blank' href='https://yukon.ca/maps' rel='nofollow ugc noopener noreferrer'> Government of Yukon</a> . Discover more digital map data and interactive maps from Yukon""s digital map data collection.<br><br><p style='margin:0;'><br />&nbsp;<br><br><p style='margin:0;'>&nbsp;<br><br><p style='margin:0;'> For more information: <a href='mailto:geomatics.help@yukon.ca' rel='nofollow ugc'> geomatics.help@yukon.ca</a><br><br>",As Needed,,https://yukon.maps.arcgis.com/home/item.html?id=49cc2473b4904ced9dbd530944f5d2e1,,ogly,2017-09-26T19:38:58.000Z,2025-07-14T18:34:40.000Z,Geomatics Yukon,https://yukon.maps.arcgis.com/sharing/rest/content/items/49cc2473b4904ced9dbd530944f5d2e1/info/metadata/metadata.xml,"-140.3536,59.0352,-121.2999,68.4312",Yukon,"mining reports,Yukon,Mining,Mining Recorder,Claims,Assessment Reports,prospecting,reports,Assessment Report Footprints,Yukon Geological Survey,GeoYukon",,,Assessment report footprints,"Economics and Industry,Nature and environment"
255,public,Government of Yukon,mailto:Geomatics.Help@yukon.ca,Geomatics Yukon,Places,,,"The Yukon Geological Survey has compiled a collection of papers, theses, reports and maps that describe permafrost in the Yukon. These reports have been footprinted and indexed to make them easier to find spatially.<br /><br><br>  Distributed from <a href='https://yukon.ca/geoyukon' rel='nofollow ugc'>  GeoYukon</a>    by the <a href='https://yukon.ca/maps' rel='nofollow ugc'>  Government of Yukon</a>  . Discover more digital map data and interactive maps from Yukon's digital map data collection.<br><br>  For more information: <a href='mailto:geomatics.help@yukon.ca' rel='nofollow ugc'>  geomatics.help@yukon.ca<br /></a><br><br>",As Needed,,https://yukon.maps.arcgis.com/home/item.html?id=4ac1b6d2e4ea4f3c8483175d1f9cb40d,,ogly,2021-09-01T14:52:33.000Z,2022-01-06T22:16:55.000Z,Geomatics Yukon,https://yukon.maps.arcgis.com/sharing/rest/content/items/4ac1b6d2e4ea4f3c8483175d1f9cb40d/info/metadata/metadata.xml,"-140.8462,59.7218,-120.0401,69.5187",Yukon,"GeoYukon,Yukon,geology,geoscience,permafrost,borehole,geotechnical,hydrology,groundwater,drinking water,Yukon,GeoYukon",,,Permafrost report polygon,"Nature and environment,Science and Technology"
207,public,"Oil, Gas and Mineral Resources – Government of Yukon",mailto:Geomatics.Help@yukon.ca,Geomatics Yukon,Places,,, Data for seismic surveys prior to 1999 were obtained from National Energy Board (NEB) as points data (end points and bends) in Excel file format with basic information only. The NEB dataset was not comprehensive. Seismic lines coordinates' data for some of the earliest surveys recorded during 1960s and 1970s were recorded in NAD27 and contained location errors. In addition some data were not converted to NAD83 datum currently in use therefore resulting in even larger error. Starting at 1999 seismic lines location data are provided to the Government of Yukon by exploration companies as part of their statutory reporting requirements.<br><br>  Distributed from <a href='https://yukon.ca/geoyukon' rel='nofollow ugc' style='text-decoration:underline;'>  GeoYukon</a>   by the <a href='https://yukon.ca/maps' rel='nofollow ugc' style='text-decoration:underline;'>  Government of Yukon</a>  . Discover more digital map data and interactive maps from Yukon's digital map data collection.<br><br>  <br><br>  For more information: <a href='mailto:geomatics.help@yukon.ca' rel='nofollow ugc' style='text-decoration:underline;'>  geomatics.help@yukon.ca</a><br><br>,As Needed,,https://yukon.maps.arcgis.com/home/item.html?id=4b1a7bb3fd3843a4bb2a77c31039019a,,ogly,2016-06-10T21:00:14.000Z,2021-01-03T22:24:58.000Z,Geomatics Yukon,https://yukon.maps.arcgis.com/sharing/rest/content/items/4b1a7bb3fd3843a4bb2a77c31039019a/info/metadata/metadata.xml,"-139.0881,60.0593,-120.0568,69.3150",Yukon,"Yukon,Seismic,GeoYukon,Oil and Gas,Yukon,GeoYukon",,,Oil and Gas Seismic Lines,"Economics and Industry,Nature and environment"
331,public,Geomatics Yukon – Government of Yukon,mailto:Geomatics.Help@yukon.ca,Geomatics Yukon,Places,,, Footprints for all imagery in the  G overnment of Yukon High Resolution Satellite  I magery  S ervice.<br><br>  Distributed from <a href='https://yukon.ca/geoyukon' rel='nofollow ugc'>  GeoYukon</a>   by the <a href='https://yukon.ca/maps' rel='nofollow ugc'>  Government of Yukon</a>  . Discover more digital map data and interactive maps from Yukon's digital map data collection.<br><br>  For more information: <a href='mailto:geomatics.help@yukon.ca' target='_blank' rel='nofollow ugc noopener noreferrer'>geomatics.help@yukon.ca</a><br><br> <br><br>,As Needed,,https://yukon.maps.arcgis.com/home/item.html?id=4b8c50a1118e42fe9db4305c068ba113,,ogly,2017-09-27T00:19:28.000Z,2025-05-28T20:38:30.000Z,Geomatics Yukon,https://yukon.maps.arcgis.com/sharing/rest/content/items/4b8c50a1118e42fe9db4305c068ba113/info/metadata/metadata.xml,"-140.3446,59.7492,-120.0093,69.4209",Yukon,"satellite,whitehorse,yukon,raster,nrcan,government,resolution,image,high,GeoYukon",,,Footprints Yukon High Resolution Satellite Imagery,"Nature and environment,Science and Technology"
271,public,"Oil, Gas and Mineral Resources – Government of Yukon",mailto:Geomatics.Help@yukon.ca,Geomatics Yukon,Places,,,  Oil and gas well reports to be used in conjunction with Oil and Gas Wells - 50k.<br><br>  Distributed from <a href='https://yukon.ca/geoyukon' style='text-decoration:underline;' rel='nofollow ugc'>  GeoYukon</a>   by the <a href='https://yukon.ca/maps' style='text-decoration:underline;' rel='nofollow ugc'>  Government of Yukon</a>  . Discover more digital map data and interactive maps from Yukon's digital map data collection.<br><br>  For more information: <a href='mailto:geomatics.help@yukon.ca' style='text-decoration:underline;' rel='nofollow ugc'>  geomatics.help@yukon.ca</a><br><br>,As Needed,,https://yukon.maps.arcgis.com/home/item.html?id=4bada38beb8a4d69bab598e158362d2d,,ogly,2016-06-10T21:28:42.000Z,2022-05-03T20:36:08.000Z,Geomatics Yukon,https://yukon.maps.arcgis.com/sharing/rest/content/items/4bada38beb8a4d69bab598e158362d2d/info/metadata/metadata.xml,"-140.9246,59.7163,-111.6295,75.6439",Yukon,"Yukon,GeoYukon,oil and gas,geoscience,permafrost,borehole,geotechnical",,,Well Report Table,"Economics and Industry,Nature and environment"
179,public,Department of Highways and Public Works – Government of Yukon,mailto:Geomatics.Help@yukon.ca,Geomatics Yukon,Places,,, This dataset  includes all  drainage  culverts with a n opening diameter of less than 2 metres. Culverts with a diameter greater than 2 metres are defined as structural culverts and are not present in this dataset. <br><br>  Distributed from <a href='https://yukon.ca/geoyukon' rel='nofollow ugc'>  GeoYukon</a>   by the <a href='https://yukon.ca/maps' rel='nofollow ugc'>  Government of Yukon</a>  . Discover more digital map data and interactive maps from Yukon's digital map data collection.<br><br>  For more information: <a href='mailto:geomatics.help@yukon.ca' rel='nofollow ugc'>  geomatics.help@yukon.ca</a><br><br>,As Needed,,https://yukon.maps.arcgis.com/home/item.html?id=4c69d7908442468e87633c96cc63860f,,ogly,2018-04-06T17:51:59.000Z,2021-01-03T21:53:46.000Z,Geomatics Yukon,https://yukon.maps.arcgis.com/sharing/rest/content/items/4c69d7908442468e87633c96cc63860f/info/metadata/metadata.xml,"-140.1262,59.2804,-127.2894,67.0072",Yukon,"transportation,Canada,Yukon,culvert,drainage,GeoYukon,Withdrawal,OIC,Lands Act,Order in Council,Commissioner's Order,Regulation,O.I.C.,Yukon,GeoYukon",,,Drainage Culverts - 25k,Transport
383,public,Government of Yukon,mailto:Geomatics.Help@yukon.ca,Geomatics Yukon,Places,,,"<p style='margin:0;'> This layer shows surveyed parcels that fall under the Agricultural Development Area Regulations or are within an agricultural zone as defined in one of the Development Area Regulations (<a target='_blank' href='https://yukon.ca/en/find-zoning-maps-yukon-communities' rel='nofollow ugc noopener noreferrer'> Find zoning maps for Yukon communities | Government of Yukon</a> ). The field ""Title Description"" indicates if the parcels is titled to private, a government entity (commissioner, community or federal) or untitled. If you find any errors in the dataset please contact <a href='mailto:lands.gis@yukon.ca' rel='nofollow ugc'> lands.gis@yukon.ca</a><br><br>&nbsp;<br><br><p style='margin:0;'> Distributed from <a target='_blank' href='https://yukon.ca/geoyukon' rel='nofollow ugc noopener noreferrer'> GeoYukon</a>  by the <a target='_blank' href='https://yukon.ca/maps' rel='nofollow ugc noopener noreferrer'> Government of Yukon</a> .<br><br><p style='margin:0;'>&nbsp;<br><br><p style='margin:0;'> Discover more digital map data and interactive maps from Yukon's digital map data collection. For more information: <a href='mailto:geomatics.help@yukon.ca' rel='nofollow ugc'> geomatics.help@yukon.ca</a><br><br>&nbsp;<br><br>",As Needed,,https://yukon.maps.arcgis.com/home/item.html?id=4c7259f4d84f4f6fb7e490d309b53449,,ogly,2024-06-26T18:04:12.000Z,2025-07-14T18:40:27.000Z,Geomatics Yukon,https://yukon.maps.arcgis.com/sharing/rest/content/items/4c7259f4d84f4f6fb7e490d309b53449/info/metadata/metadata.xml,"-139.9463,59.8526,-128.1522,64.3349",Yukon,"Agriculture,Lands,Yukon,GeoYukon,GeoYukon,Yukon",,,Agricultural Land Parcels - Surveyed,"Agriculture,Economics and Industry"
